{
  "id": "IMPORT-CANON-001",
  "agent": "canon-continuity-reviewer",
  "category": "TIMELINE_RISK",
  "severity": "MUST_FIX",
  "location": {
    "file": "source-zip/31.개혁.txt",
    "paragraph": null,
    "line": null
  },
  "original": "\"두 해가 흐르는 동안\" 이후 같은 도입부에서 \"1185년 부활절\"",
  "issue": "26화가 4년 시간점프 뒤 1185년 늦봄/부활절 부근을 명시한 뒤 연속 전개되는 31화가 다시 2년 경과와 1185년을 동시에 제시한다.",
  "rationale": "두 해 경과를 문자 그대로 따르면 31화는 약 1187년이어야 하나, 31~32화는 1185년 개혁 국면으로 서술된다. 이후 1184~1187 기술 실험 로그와 1193년의 \"지난 십여 년\" 농업 회고까지 연결되어 있어 단일 문구를 자동 수정하면 다른 연표를 왜곡할 수 있다.",
  "confidence": 0.99,
  "evidence_type": "CANON",
  "source_refs": [
    "source-zip/26.끝, 그리고, 시작.txt",
    "source-zip/31.개혁.txt",
    "source-zip/32.개혁 (2).txt",
    "source-zip/48.불을 가두다.txt",
    "canon/timeline.md"
  ],
  "suggested_patch": "작가가 26~32화의 기준연도를 확정한 뒤, (A) 31화의 \"두 해\"를 제거/단축하여 1185년을 유지하거나 (B) 31화 이후 연도를 재배치한다. 결정 전까지 canon/timeline.md에서는 CONFLICT로 유지한다.",
  "preserve_if_intentional": false,
  "status": "OPEN"
}
