{
  "id": "IMPORT-TERM-002",
  "agent": "typo-mechanics-checker",
  "category": "NAME_CONSISTENCY",
  "severity": "SHOULD_FIX",
  "location": {
    "file": "source-zip/99.물레.txt",
    "paragraph": null,
    "line": null
  },
  "original": "\"유수프 빈 이브라힘 알라다키\" / \"유수프 빈 이브라힘 알라디키\" 혼용",
  "issue": "동일 인물의 이름/니스바 표기가 흔들린다.",
  "rationale": "99~101화의 로마인 정체성 논쟁 핵심 인물이므로 검색·캐릭터 정본에서 표기 흔들림의 영향이 크다.",
  "confidence": 1.0,
  "evidence_type": "MECHANICAL",
  "source_refs": [
    "source-zip/99.물레.txt",
    "source-zip/100.로마인.txt",
    "source-zip/101.알팔파.txt",
    "canon/world-bible.md"
  ],
  "suggested_patch": "최종 표기를 하나 선택해 통일한다. 현재 canon은 최근 다수 표기인 \"알라디키\"를 임시 표시하되 terminology finding이 닫히기 전에는 강제 교정하지 않는다.",
  "preserve_if_intentional": true,
  "status": "OPEN"
}
